{
  "$schema": "https://json-schema.org/draft/2020-12/schema",
  "$id": "https://github.com/carloseduardo00/mu-explorer/schema/map.schema.json",
  "title": "Map",
  "description": "Mapa do jogo.",
  "type": "object",
  "additionalProperties": false,
  "required": [
    "id",
    "name",
    "season",
    "source",
    "source_url",
    "scraped_at"
  ],
  "properties": {
    "id": {
      "type": "string",
      "pattern": "^[a-z0-9]+(-[a-z0-9]+)*$"
    },
    "name": {
      "type": "string",
      "minLength": 1
    },
    "season": {
      "type": [
        "string",
        "null"
      ],
      "description": "Season dos dados (ex.: 'S19'); null quando a fonte não informa."
    },
    "source": {
      "type": "string",
      "pattern": "^[a-z0-9_]+$"
    },
    "source_url": {
      "type": "string",
      "pattern": "^https?://"
    },
    "scraped_at": {
      "type": "string",
      "pattern": "^\\d{4}-\\d{2}-\\d{2}T\\d{2}:\\d{2}:\\d{2}Z$"
    }
  }
}
